{
  "$schema": "https://json-schema.org/draft/2020-12/schema",
  "$id": "https://owieschon.github.io/agent-governance-lab/schemas/trusted-release.schema.json",
  "title": "AGL trusted comparison source manifest",
  "type": "object",
  "additionalProperties": false,
  "required": ["$schema", "schema_version", "protocol_id", "locked_at", "files"],
  "properties": {
    "$schema": { "const": "../schemas/trusted-release.schema.json" },
    "schema_version": { "const": "agl.comparison-trusted-release.v1" },
    "protocol_id": { "const": "agl-advisory-v-enforced-2026-07-10" },
    "locked_at": { "const": "2026-07-10" },
    "files": {
      "type": "array",
      "minItems": 1,
      "items": {
        "type": "object",
        "additionalProperties": false,
        "required": ["path", "sha256"],
        "properties": {
          "path": { "type": "string", "pattern": "^[A-Za-z0-9._/-]+$" },
          "sha256": { "$ref": "#/$defs/sha256" }
        }
      }
    }
  },
  "$defs": {
    "sha256": { "type": "string", "pattern": "^[0-9a-f]{64}$" }
  }
}
